{
  "candidate_id": "EX-003",
  "title": "Bayanat Labs example with a red legal tier (illustrative)",
  "scores": {
    "impact": 5,
    "claim_strength": 5,
    "ease": 5,
    "legal_cleanliness": 1,
    "commercial_pull": 5
  },
  "legal_tier": "red",
  "effort": "S",
  "weighted_score_0_100": 80.0,
  "legal_verdict": "excluded",
  "max_release_tier": null,
  "suggested_priority": null,
  "priority_rule": null,
  "seo_demand": null,
  "warnings": [
    "legal_tier red: excluded regardless of score (not built). Score a compliant alternative as its own candidate."
  ],
  "weights": {
    "impact": 30.0,
    "claim_strength": 20.0,
    "ease": 20.0,
    "legal_cleanliness": 20.0,
    "commercial_pull": 10.0
  },
  "thresholds_status": "Adopted for v1.0, provisional. The coordinator decides each case.",
  "policy_version": "1.0.1"
}
