{
  "candidate_id": "EX-004",
  "title": "Bayanat Labs example flagship needing months of work (illustrative)",
  "scores": {
    "impact": 5,
    "claim_strength": 5,
    "ease": 3,
    "legal_cleanliness": 5,
    "commercial_pull": 5
  },
  "legal_tier": "green",
  "effort": "L",
  "weighted_score_0_100": 90.0,
  "legal_verdict": "tier1_eligible",
  "max_release_tier": 1,
  "suggested_priority": "P1",
  "priority_rule": "score >= 60",
  "seo_demand": null,
  "warnings": [
    "score meets the P0 threshold (75) but effort is L; P0 needs effort S/M, so the suggestion is P1.",
    "no justifications recorded; add one line per score."
  ],
  "weights": {
    "impact": 30.0,
    "claim_strength": 20.0,
    "ease": 20.0,
    "legal_cleanliness": 20.0,
    "commercial_pull": 10.0
  },
  "thresholds_status": "Adopted for v1.0, provisional. The coordinator decides each case.",
  "policy_version": "1.0.1"
}
