{
  "candidate_id": "EX-002",
  "title": "Bayanat Labs example speech manifests (illustrative)",
  "scores": {
    "impact": 4,
    "claim_strength": 4,
    "ease": 3,
    "legal_cleanliness": 3,
    "commercial_pull": 5
  },
  "legal_tier": "yellow",
  "effort": "M",
  "weighted_score_0_100": 67.5,
  "legal_verdict": "tier2_only",
  "max_release_tier": 2,
  "suggested_priority": "P1",
  "priority_rule": "score >= 60",
  "seo_demand": null,
  "warnings": [
    "legal_tier yellow: Tier 2 only (manifests and own annotations, no verbatim content); the scoping memo must name a collection basis."
  ],
  "weights": {
    "impact": 30.0,
    "claim_strength": 20.0,
    "ease": 20.0,
    "legal_cleanliness": 20.0,
    "commercial_pull": 10.0
  },
  "thresholds_status": "Adopted for v1.0, provisional. The coordinator decides each case.",
  "policy_version": "1.0.1"
}
